{
  "environment": {
    "build_type": "RelWithDebInfo",
    "cmake_version": "4.2.0-rc2",
    "compiler": "MSVC 194435228",
    "cpu_name": "Intel64 Family 6 Model 198 Stepping 2, GenuineIntel",
    "dependency_lock_hash": "0bceba7a04ce3a9259f98a83fe33e100ef107d9ed5ebb3638901682e0d44c67d",
    "driver_version": "queried-at-runtime",
    "gpu_name": "NVIDIA GeForce RTX 5080",
    "helios_git_hash": "3dd20085ab5d863b82d169b453216ef59a58eb50",
    "helios_version": "0.1.0",
    "os_name": "Windows 10.0 (build 26200)",
    "quality_preset": "balanced",
    "resolution": "1280x720",
    "slang_version": "slangc C:/Users/leonh/Documents/Helios/.deps-cache/slang-windows-x64/bin/slangc.exe:\n2026.14.1",
    "timestamp_utc": "2026-08-21T16:06:56Z",
    "validation_layers": "enabled"
  },
  "format": "helios-evidence-report",
  "notes": [],
  "schema_version": 1,
  "smoke_paths": [],
  "validation_error_count": 0,
  "validation_warning_count": 0
}